{
  "comparisons": {
    "sourcefirst_ambiguous": {
      "basis": null,
      "basis_reference": null,
      "operations": [],
      "state": "not_attempted"
    },
    "sourcefirst_direct_http": {
      "basis": null,
      "basis_reference": null,
      "operations": [],
      "state": "not_attempted"
    },
    "sourcefirst_dynamic": {
      "basis": null,
      "basis_reference": null,
      "operations": [],
      "state": "not_attempted"
    },
    "sourcefirst_no_source": {
      "basis": null,
      "basis_reference": null,
      "operations": [],
      "state": "not_attempted"
    },
    "sourcefirst_not_applicable": {
      "basis": null,
      "basis_reference": null,
      "operations": [],
      "state": "not_attempted"
    },
    "sourcefirst_sdk_http": {
      "basis": null,
      "basis_reference": null,
      "operations": [],
      "state": "not_attempted"
    },
    "sourcefirst_sdk_symbol": {
      "basis": null,
      "basis_reference": null,
      "operations": [],
      "state": "not_attempted"
    },
    "sourcefirst_unresolved": {
      "basis": null,
      "basis_reference": null,
      "operations": [],
      "state": "not_attempted"
    }
  },
  "document_state": "absent",
  "kind": "infrawright.openapi_diagnostics",
  "reason_code": null,
  "schema_version": 1,
  "source_manifest_sha256": "f12cf9a5321e46a776e88da4610bfb834e81cdfb02e708e5d1ecbf2e0996c9c7",
  "source_report_sha256": "af9f19e3a02957d0607e9f4dd7de74f1911adf8f8373cc9f4d3f2dae8573cdf6",
  "source_trust": "verified",
  "summary": {
    "comparison_counts": {
      "ambiguous": 0,
      "conflict": 0,
      "corroborated": 0,
      "missing_path": 0,
      "not_attempted": 8,
      "not_comparable": 0
    },
    "comparison_eligible_total": 2,
    "degraded_comparison_total": 0
  }
}
